Title,Start,End,Description,Web Page,Media,Media Caption,Media Credit,Tags,Place,Location,Source,Source URL
Battle of Stallupönen,1914-08-17,,"The Battle of Stallupönen, fought between Russian and German armies on August 17, 1914, was the opening battle of World War I on the Eastern Front. It was a minor German success, but did little to upset the Russian timetable.",,,,,,,"54.6306,22.5733",,
Siege of Toma,1914-09-17,,The Siege of Toma was a bloodless action during the First World War on the island of New Britain between 14–17 September 1914 as part of the occupation of German New Guinea by the Australian Naval and Military Expeditionary Force (AN&MEF).,,,,,,,"-4.38333,152.167",,
Battle of Flers-Courcelette,1916-09-22,,"The Battle of Flers–Courcelette, was a battle within the Franco-British Somme Offensive which took place in the summer and autumn of 1916. Launched on the 15 September 1916 the battle went on for one week. Flers–Courcelette began with the objective of cutting a hole in the German line by using massed artillery and infantry attacks. This hole would then be exploited with the use of cavalry. It was the third and final general offensive mounted by the British Army during the Battle of the Somme.",,,,,,,"50.0589,2.74778",,
First Battle of Ypres,1914-11-22,,"The First Battle of Ypres, also called the First Battle of Flanders (French: 1re Bataille des Flandres), was a First World War battle fought for the strategic town of Ypres in western Belgium in October and November 1914. The German and Western Allied attempts to secure the town from enemy occupation included a series of further battles in and around the West Flanders Belgian municipality. The strategy of both the Allied and German armies is not entirely clear.",,,,,,,"50.8641,2.8956",,
First Battle of Ypres,1914-11-22,,"The First Battle of Ypres, also called the First Battle of Flanders (French: 1re Bataille des Flandres), was a First World War battle fought for the strategic town of Ypres in western Belgium in October and November 1914. The German and Western Allied attempts to secure the town from enemy occupation included a series of further battles in and around the West Flanders Belgian municipality. The strategy of both the Allied and German armies is not entirely clear.",,,,,,,"50.8641,2.8956",,
First Battle of Ypres,1914-11-22,,"The First Battle of Ypres, also called the First Battle of Flanders (French: 1re Bataille des Flandres), was a First World War battle fought for the strategic town of Ypres in western Belgium in October and November 1914. The German and Western Allied attempts to secure the town from enemy occupation included a series of further battles in and around the West Flanders Belgian municipality. The strategy of both the Allied and German armies is not entirely clear.",,,,,,,"50.8641,2.8956",,
First Battle of Ypres,1914-11-22,,"The First Battle of Ypres, also called the First Battle of Flanders (French: 1re Bataille des Flandres), was a First World War battle fought for the strategic town of Ypres in western Belgium in October and November 1914. The German and Western Allied attempts to secure the town from enemy occupation included a series of further battles in and around the West Flanders Belgian municipality. The strategy of both the Allied and German armies is not entirely clear.",,,,,,,"50.8641,2.8956",,
Battle of Kahe,1916-03-18,,"The Battle of Kahe was fought during the East African Campaign of World War I. It was the last action between German and Entente forces before the German retreat from the Kilimanjaro area. British and South African forces surrounded German positions at Kahe, south of Mount Kilimanjaro. Entente forces inflicted heavy casualties and captured large German artillery pieces while receiving comparably little casualties. German forces retreated from there, further into the interior of the colony.",,,,,,,"-2.26667,37.8667",,
Battle of Amiens (1918),1918-08-12,,"The Battle of Amiens (also known as the Third Battle of Picardy), which began on 8 August 1918, was the opening phase of the Allied offensive later known as the Hundred Days Offensive that ultimately led to the end of the First World War. Allied forces advanced over seven miles on the first day, one of the greatest advances of the war, with Henry Rawlinson's British Fourth Army playing the decisive role.",,,,,,,"49.8939,2.29425",,
Battle of Bazentin Ridge,1916-07-14,,"The Battle of Bazentin Ridge, launched by the British Fourth Army at dawn on 14 July 1916, marked the start of the second phase of the Battle of the Somme. Dismissed beforehand by one French commander as ""an attack organized for amateurs by amateurs"", it turned out to be ""hugely successful"" for the British, in complete contrast to the disaster of the first day on the Somme.",,,,,,,"50.0274,2.75417",,
Battle of Bita Paka,1914-09-11,,"The Battle of Bita Paka (11 September 1914) was fought south of Kabakaul, on the island of New Britain, and was a part of the invasion and subsequent occupation of German New Guinea by the Australian Naval and Military Expeditionary Force shortly after the outbreak of the First World War.",,,,,,,"-4.41667,152.317",,
Battle of Bita Paka,1914-09-11,,"The Battle of Bita Paka (11 September 1914) was fought south of Kabakaul, on the island of New Britain, and was a part of the invasion and subsequent occupation of German New Guinea by the Australian Naval and Military Expeditionary Force shortly after the outbreak of the First World War.",,,,,,,"-4.41667,152.317",,
Battle of Fromelles,1916-07-20,,"The Battle of Fromelles occurred in France between 19 and 20 July 1916, during World War I. The action was intended partly as a diversion from the Battle of the Somme that was taking place about 80 kilometres to the south. The operation, carried out midway between the British-occupied village of Fleurbaix and that of Fromelles behind the German lines, sought to retake a salient just north of the latter, situated at about 16 kilometres from the city of Lille.",,,,,,,"50.6063,2.85469",,
Battle of Kakamas,1915-02-04,,"The battle of Kakamas took place in Kakamas, Northern Cape Province of South Africa on 4 February 1915. It was a skirmish for control of two river fords over the Orange River between contingents of a German invasion force and South African armed forces. The South Africans succeed in preventing the Germans gaining control of the fords and crossing the river.",,,,,,,"-28.8,20.65",,
Battle of Kakamas,1915-02-04,,"The battle of Kakamas took place in Kakamas, Northern Cape Province of South Africa on 4 February 1915. It was a skirmish for control of two river fords over the Orange River between contingents of a German invasion force and South African armed forces. The South Africans succeed in preventing the Germans gaining control of the fords and crossing the river.",,,,,,,"-28.8,20.65",,
Battle of Kakamas,1915-02-04,,"The battle of Kakamas took place in Kakamas, Northern Cape Province of South Africa on 4 February 1915. It was a skirmish for control of two river fords over the Orange River between contingents of a German invasion force and South African armed forces. The South Africans succeed in preventing the Germans gaining control of the fords and crossing the river.",,,,,,,"-28.8,20.65",,
Battle of Kilimanjaro,1914-11-03,,The Battle of Kilimanjaro at Longido took place in German East Africa in November 1914 and was an early skirmish during the East African Campaign of the First World War.,,,,,,,"-3.07583,37.3533",,
Battle of Liège,1914-08-16,,"The Battle of Liège was the opening engagement of the German invasion of Belgium, and the first battle of World War I. The attack on the city began on 5 August 1914 and lasted until the 16th when the last Belgian fort finally surrendered. The invasion of Belgium was the event that triggered the United Kingdom's entry into the war; the unexpected vigor of the city's defense allowed more time for the western Allies to organize and prepare their defense of France.",,,,,,,"50.6406,5.5721",,
Battle of Liège,1914-08-16,,"The Battle of Liège was the opening engagement of the German invasion of Belgium, and the first battle of World War I. The attack on the city began on 5 August 1914 and lasted until the 16th when the last Belgian fort finally surrendered. The invasion of Belgium was the event that triggered the United Kingdom's entry into the war; the unexpected vigor of the city's defense allowed more time for the western Allies to organize and prepare their defense of France.",,,,,,,"50.6406,5.5721",,
Battle of Mahiwa,1917-10-18,,"The Battle of Mahiwa fought between German and British Imperial forces was a battle of the East African Campaign of World War I. The battle began when South African and Nigerian troops under Lieutenant General Jacob van Deventer engaged a column of German forces under the command of General Paul Emil von Lettow-Vorbeck at Mahiwa in German East Africa. The Germans were able to inflict massive casualties upon van Deventer's army, forcing it to withdraw.",,,,,,,"-10.35,39.2667",,
Battle of Mons,1914-08-23,,"The Battle of Mons was the first major action of the British Expeditionary Force (BEF) in the First World War. It was a subsidiary action of the Battle of the Frontiers, in which the Allies clashed with Germany on the French borders. At Mons, the British army attempted to hold the line of the Mons-Condé Canal against the advancing German First Army.",,,,,,,"50.45,3.95",,
Battle of Ngomano,1917-11-25,,The Battle of Ngomano was fought between the German Empire and Portugal during the East African Campaign of World War I. A force of Germans and Askaris under Paul Emil von Lettow-Vorbeck had just won a costly victory against the British at the Battle of Mahiwa and were running critically low on supplies. To remedy the problem the Germans invaded Portuguese East Africa in an attempt to escape superior British forces to the north and resupply from captured Portuguese materiel.,,,,,,,"-11.4283,38.4936",,
Battle of Otavi,1915-07-01,,"The Battle of Otavi fought between the militaries of the Union of South Africa and German Southwest Africa on 1 July, 1915 was the final battle of the South-West Africa Campaign of World War I. The battle, fought between Otavi mountain and Otavifontein, was a delaying action led by the German Major Hermann Ritter. Ritter's forces intended to buy the main German force at Tsombe several days so as they could harden their positions there.",,,,,,,"-19.65,17.3333",,
Battle of Otavi,1915-07-01,,"The Battle of Otavi fought between the militaries of the Union of South Africa and German Southwest Africa on 1 July, 1915 was the final battle of the South-West Africa Campaign of World War I. The battle, fought between Otavi mountain and Otavifontein, was a delaying action led by the German Major Hermann Ritter. Ritter's forces intended to buy the main German force at Tsombe several days so as they could harden their positions there.",,,,,,,"-19.65,17.3333",,
Battle of Otavi,1915-07-01,,"The Battle of Otavi fought between the militaries of the Union of South Africa and German Southwest Africa on 1 July, 1915 was the final battle of the South-West Africa Campaign of World War I. The battle, fought between Otavi mountain and Otavifontein, was a delaying action led by the German Major Hermann Ritter. Ritter's forces intended to buy the main German force at Tsombe several days so as they could harden their positions there.",,,,,,,"-19.65,17.3333",,
Battle of Poelcappelle,1917-10-09,,"The Battle of Poelcappelle (9 October 1917) marked the end of the string of highly successful British attacks in late September and early October 1917, during the Third Battle of Ypres. Only the supporting attack in the north achieved a substantial advance. On the main front the German defences withstood the limited amount of artillery fire achieved by the British after the attack of 4 October.",,,,,,,"50.922,2.963",,
Battle of Pozières,1916-08-07,,"The Battle of Pozières was a two week struggle for the French village of Pozières and the ridge on which it stands, during the middle stages of the 1916 Battle of the Somme. Though British divisions were involved in most phases of the fighting, Pozières is primarily remembered as an Australian battle. The fighting ended with the Allied forces in possession of the plateau north and east of the village, and in a position to menace the German bastion of Thiepval from the rear.",,,,,,,"50.0167,2.8",,
Battle of Thiepval Ridge,1916-09-28,,The Battle of Thiepval Ridge was the first large offensive mounted by the Reserve Army of Lieutenant General Hubert Gough during the Battle of the Somme and was intended to benefit from the Fourth Army attack at Morval by starting 24 hours afterwards.,,,,,,,"50.0545,2.68839",,
Battle of Trekkopjes,1915-04-26,,"The Battle of Trekkopjes on 26 April 1915 was a German assault on the South African held town of Trekkopjes during the South-West Africa Campaign of World War I. The South African Major Skinner had been ordered to defend Trekkopjes, and came into contact with a German column advancing on that town. Skinner withdrew back into Trekkopjes and dug in his forces. The German attack was repulsed with the help of armoured cars, leaving the South Africans victorious.",,,,,,,"-22.293,15.103",,
Battle of Trekkopjes,1915-04-26,,"The Battle of Trekkopjes on 26 April 1915 was a German assault on the South African held town of Trekkopjes during the South-West Africa Campaign of World War I. The South African Major Skinner had been ordered to defend Trekkopjes, and came into contact with a German column advancing on that town. Skinner withdrew back into Trekkopjes and dug in his forces. The German attack was repulsed with the help of armoured cars, leaving the South Africans victorious.",,,,,,,"-22.293,15.103",,
Battle of Trekkopjes,1915-04-26,,"The Battle of Trekkopjes on 26 April 1915 was a German assault on the South African held town of Trekkopjes during the South-West Africa Campaign of World War I. The South African Major Skinner had been ordered to defend Trekkopjes, and came into contact with a German column advancing on that town. Skinner withdrew back into Trekkopjes and dug in his forces. The German attack was repulsed with the help of armoured cars, leaving the South Africans victorious.",,,,,,,"-22.293,15.103",,
Battle of Vimy Ridge,1917-04-12,,"The Battle of Vimy Ridge was a military engagement fought primarily as part of the Battle of Arras, in the Nord-Pas-de-Calais region of France, during the First World War. The main combatants were the Canadian Corps, of four divisions, against three divisions of the German Sixth Army. The battle, which took place from 9 to 12 April 1917, was part of the opening phase of the British-led Battle of Arras, a diversionary attack for the French Nivelle Offensive.",,,,,,,"50.379,2.774",,
Battle of Vimy Ridge,1917-04-12,,"The Battle of Vimy Ridge was a military engagement fought primarily as part of the Battle of Arras, in the Nord-Pas-de-Calais region of France, during the First World War. The main combatants were the Canadian Corps, of four divisions, against three divisions of the German Sixth Army. The battle, which took place from 9 to 12 April 1917, was part of the opening phase of the British-led Battle of Arras, a diversionary attack for the French Nivelle Offensive.",,,,,,,"50.379,2.774",,
Battle of the Ancre,1916-11-18,,"The Battle of the Ancre 13–18 November, was the final large British attack of the Battle of the Somme in 1916, before the winter weather forced a pause in British attacks until the new year. It was fought by the Fifth Army, under the command of Lieutenant General Hubert Gough, against the German First Army under General von Below. The intent of the British attack was to fulfill complementary objectives.",,,,,,,"50.0667,2.7",,
Battle of the Sambre (1918),1918-11-04,,"The Second Battle of the Sambre (November 4, 1918) (which included the Second Battle of Guise and the Battle of Thiérache) was part of the final European Allied offensives of World War I.",,,,,,,"50.4667,4.86667",,
First Battle of Passchendaele,1917-10-12,,"The First Battle of Passchendaele took place on 12 October 1917 in the Ypres Salient area of the Western Front, west of Passchendaele village, during the Third Battle of Ypres in World War I. The Allied plan to capture Passchendaele village was based on inaccurate information about the result of the previous attack of 9 October, as the period of rainy weather continued. The attack took ground in the north but early gains around Passchendaele were mostly lost to German counter-attacks.",,,,,,,"50.9003,3.02111",,
Flămânda Offensive,1916-09-29,,"The Flămânda Offensive (or Flămânda Maneuver, which took place between 29 September and 5 October 1916, was an offensive across the Danube mounted by the Romanian 2nd Army during World War I. The battle represented a consistent effort by the Romanian Army to stop the Central Powers south offensive led by August von Mackensen. The battle ended as a tactical victory for the Central Powers.",,,,,,,"43.9875,26.245",,
Flămânda Offensive,1916-10-05,,"The Flămânda Offensive (or Flămânda Maneuver, which took place between 29 September and 5 October 1916, was an offensive across the Danube mounted by the Romanian 2nd Army during World War I. The battle represented a consistent effort by the Romanian Army to stop the Central Powers south offensive led by August von Mackensen. The battle ended as a tactical victory for the Central Powers.",,,,,,,"43.9875,26.245",,
Battle of Verdun,1916-12-18,,"The Battle of Verdun was one of the major battles during the First World War on the Western Front. It was fought between the German and French armies, from 21 February to 18 December 1916, on hilly terrain north of the city of Verdun-sur-Meuse in north-eastern France. It ended with a French tactical victory since, by December 1916, they had recaptured most of the lost ground including the centerpiece of Verdun's defensive system: Fort Douaumont.",,,,,,,"49.208,5.422",,
Battle of Bukoba,1915-06-23,,"The Battle of Bukoba was the first victory for Entente forces in German East Africa, coming after the disastrous battles of Tanga and Jassin. The British objective was the destruction of the Bukoba wireless station. Due to Bukoba's location on the shore of Lake Victoria, it was decided that the raid should take the form of an amphibious assault.",,,,,,,"-1.33333,31.8167",,
Battle of Delville Wood,1916-09-15,,"The Battle of Delville Wood 14 July—3 September, was an engagement in the 1916 Battle of the Somme in the First World War. It took place between the armies of the German Empire and allied British and empire forces. Delville Wood is to the north east of the town of Longueval in the département of the Somme in northern France.",,,,,,,"50.0278,2.8099",,
Battle of Guillemont,1916-09-06,,"The Battle of Guillemont was a British assault on the German-held village of Guillemont during the 1916 Battle of the Somme. Guillemont lay on the right flank of the British sector where it linked with French forces and by holding it, the Germans prevented the Allied armies from operating in unison. Guillemont came in range of British forces following the Battle of Bazentin Ridge on 14 July and it was subjected to a number of costly attacks in late July and August.",,,,,,,"50.0138,2.82444",,
Battle of Kisaki,1916-09-11,,"The Battle of Kisaki was a confrontation between German and South Africa forces near the town of Kisaki, German East Africa, on 7–8 September 1916.",,,,,,,"-7.48611,37.6014",,
Battle of Kondoa Irangi,1916-05-10,,"The Battle of Kondoa Irangi was a battle of the East African Campaign of World War I. Following successes at the battles of Latema Nek and Kahe, Entente forces under the overall command of General Jan Smuts continued their advance southwards into German East Africa. By April 17, 1916, General Van Deventer's 2nd Division had reached the vicinity of the town of Kondoa Irangi - where they made contact with a unit of German Schutztruppe.",,,,,,,"-4.90361,35.7767",,
Battle of Kondoa Irangi,1916-05-10,,"The Battle of Kondoa Irangi was a battle of the East African Campaign of World War I. Following successes at the battles of Latema Nek and Kahe, Entente forces under the overall command of General Jan Smuts continued their advance southwards into German East Africa. By April 17, 1916, General Van Deventer's 2nd Division had reached the vicinity of the town of Kondoa Irangi - where they made contact with a unit of German Schutztruppe.",,,,,,,"-4.90361,35.7767",,
Battle of Arras (1917),1917-05-16,,"Battle of Arras Part of the Western Front of the First World War 300pxThe Town Square, Arras, France. February, 1919.",,,,,,,"50.2897,2.78083",,
Battle of Bakhmach,1918-03-08,,"Battle of Bakhmach (Bitva u Bachmače in Czech), was a battle between the Czechoslovak Legion in Russia and German forces occupying Ukraine. The battle lasted from March 8 to March 13, 1918 over the city of Bakhmach (Бахмач), today in Ukraine. The Legion managed to escape the encirclement. On March 3, 1918 Russia, controlled by the Bolsheviks, signed the Brest-Litovsk peace treaty with Germany in which it gave up, among others, control over Ukraine.",,,,,,,"51.1828,32.8272",,
Battle of Belleau Wood,1918-06-26,,"The Battle of Belleau Wood (1–26 June 1918) occurred during the German 1918 Spring Offensive in World War I, near the Marne River in France. The battle was fought between the U.S. Second (under the command of Major General Omar Bundy) and Third Divisions and an assortment of German units including elements from the 237th, 10th, 197th, 87th, and 28th Divisions. The battle has become a deep part of the lore of the United States Marine Corps.",,,,,,,"49.073,3.29",,
Second Battle of Ypres,1915-05-25,,"The Second Battle of Ypres was a First World War battle fought for control of the strategic Flemish town of Ypres in western Belgium in the spring of 1915, following the First Battle of Ypres the previous autumn. It marked the first time that Germany used poison gas on a large scale on the Western Front. Additionally, the battle was the first time that a former colonial force defeated a major European power on European soil, in the Battle of St. Julien-Kitcheners' Wood.",,,,,,,"50.891,2.979",,
Battle of Tannenberg,1914-08-30,,"The Battle of Tannenberg was an engagement between the Russian Empire and the German Empire in the first days of World War I. It was fought by the Russian Second Army against the German Eighth Army between 26 August and 30 August 1914. The battle resulted in the almost complete destruction of the Russian Second Army. A series of follow-up battles destroyed the majority of the First Army as well, and kept the Russians off-balance until the spring of 1915.",,,,,,,"53.4958,20.1344",,
Battle of Tannenberg,1914-08-30,,"The Battle of Tannenberg was an engagement between the Russian Empire and the German Empire in the first days of World War I. It was fought by the Russian Second Army against the German Eighth Army between 26 August and 30 August 1914. The battle resulted in the almost complete destruction of the Russian Second Army. A series of follow-up battles destroyed the majority of the First Army as well, and kept the Russians off-balance until the spring of 1915.",,,,,,,"53.4958,20.1344",,
Battle of Tannenberg,1914-08-30,,"The Battle of Tannenberg was an engagement between the Russian Empire and the German Empire in the first days of World War I. It was fought by the Russian Second Army against the German Eighth Army between 26 August and 30 August 1914. The battle resulted in the almost complete destruction of the Russian Second Army. A series of follow-up battles destroyed the majority of the First Army as well, and kept the Russians off-balance until the spring of 1915.",,,,,,,"53.4958,20.1344",,
Battle of Tannenberg,1914-08-30,,"The Battle of Tannenberg was an engagement between the Russian Empire and the German Empire in the first days of World War I. It was fought by the Russian Second Army against the German Eighth Army between 26 August and 30 August 1914. The battle resulted in the almost complete destruction of the Russian Second Army. A series of follow-up battles destroyed the majority of the First Army as well, and kept the Russians off-balance until the spring of 1915.",,,,,,,"53.4958,20.1344",,
Battle of Behobeho,1917-01-03,,The Battle of Behobeho was fought during the East African Campaign of World War I.,,,,,,,"-7.63333,37.8833",,
Battle of Cantigny,1918-05-28,,"The Battle of Cantigny, fought on 28 May 1918 was the first American offensive of World War I. The U.S. 1st Division, the most experienced of the seven American divisions then in France and in reserve for the French Army near the village of Cantigny, was selected for the attack.",,,,,,,"49.664,2.491",,
Battle of Hill 70,1917-08-25,,"The Battle of Hill 70 was a localized battle of World War I between the Canadian Corps and five divisions of the German Sixth Army. The battle took place along the Western Front on the outskirts of Lens in the Nord-Pas-de-Calais region of France between 15 August 1917 and 25 August 1917. The primary objective of the assault was to inflict casualties and draw German troops away from the 3rd Battle of Ypres, rather than to capture territory.",,,,,,,"50.4556,2.81903",,
Battle of Morval,1916-09-28,,"The Battle of Morval, 25–28 September 1916, was an attack during the Battle of the Somme by the British Fourth Army on the villages of Morval, Gueudecourt and Lesboeufs held by the German 1st Army, which had been the final objectives of the Battle of Flers-Courcelette (15–22 September).",,,,,,,"50.0316,2.8424",,
