Title,Start,End,Description,Web Page,Media,Media Caption,Media Credit,Tags,Place,Location,Source,Source URL
Battle of Polygon Wood,1917-09-27,,"The Battle of Polygon Wood took place during the second phase of the Third battle of Ypres in World War I and was fought near Ypres in Belgium 26 September – 3 October 1917, in the area from the Menin Road to Polygon Wood and thence north, to the area beyond St. Julien. Much of the woodland had been destroyed by the huge quantity of shellfire from both sides since 16 July and the area had changed hands several times.",,,,,,,"50.8519,2.98528",,
Battle of Polygon Wood,1917-09-27,,"The Battle of Polygon Wood took place during the second phase of the Third battle of Ypres in World War I and was fought near Ypres in Belgium 26 September – 3 October 1917, in the area from the Menin Road to Polygon Wood and thence north, to the area beyond St. Julien. Much of the woodland had been destroyed by the huge quantity of shellfire from both sides since 16 July and the area had changed hands several times.",,,,,,,"50.8519,2.98528",,
Second Battle of Passchendaele,1917-11-10,,"The Second Battle of Passchendaele was the culminating attack during the Third Battle of Ypres of the First World War. The battle took place in the Ypres Salient area of the Western Front, in and around the Belgian town of Passchendaele, between 26 October 1917 and 10 November 1917. The Canadian Corps relieved the exhausted II Anzac Corps, continuing the advance started with the First Battle of Passchendaele and ultimately capturing Passchendaele village.",,,,,,,"50.9003,3.02111",,
Second Battle of Passchendaele,1917-11-10,,"The Second Battle of Passchendaele was the culminating attack during the Third Battle of Ypres of the First World War. The battle took place in the Ypres Salient area of the Western Front, in and around the Belgian town of Passchendaele, between 26 October 1917 and 10 November 1917. The Canadian Corps relieved the exhausted II Anzac Corps, continuing the advance started with the First Battle of Passchendaele and ultimately capturing Passchendaele village.",,,,,,,"50.9003,3.02111",,
Battle of Ginchy,1916-09-09,,"The Battle of Ginchy took place on 9 September 1916 during the Battle of the Somme when the 16th Division captured the German-held village of Ginchy. The Irish Royal Munster Fusiliers suffered heavy casualties in the process. Indeed of the two attacking brigades, the 47th Brigade (8th Battalion) failed completely, encountering enemy defences unaffected by the British bombardment whose shelling kept falling short into no-mans land.",,,,,,,"50.0227,2.83244",,
Battle of Le Transloy,1916-11-05,,The Battle of Le Transloy was the final offensive mounted by the British Fourth Army during the 1916 Battle of the Somme.,,,,,,,"50.0574,2.88772",,
Battle of Broodseinde,1917-10-04,,The Battle of Broodseinde was fought on 4 October 1917 in Flanders at the east end of the Gheluvelt plateau by the British Second and Fifth armies and the German Fourth Army. The battle was the most successful Allied attack of the Battle of Passchendaele.,,,,,,,"50.852,2.89069",,
Battle of Chra,1914-08-22,,The Battle of Chra was fought between combined British and French and German soldiers on the Chra River and in Chra village on 22 August 1914 during the Togoland Campaign of the First World War. Entrenched German forces were able to hold the Allied advance at this river for some time but eventually withdrew further inland to Kamina due to limited manpower.,,,,,,,"7.17067,1.15867",,
Battle of Agbeluvhoe,1914-08-15,,"The Battle of Agbeluvhoe (or Agbéluvhoé or Agbeluwoe), also known as the Battle of Tsewie, was fought during the First World War between invading British soldiers of the West African Rifles and German troops attempting to harass the advancing allies through the rail network in German Togoland on 15 August 1914. The plan failed, ending in an ambush and the Germans suffered heavy losses. Eventually after limited resistance from the Germans, the colony was surrendered on 26 August 1914.",,,,,,,"6.6595,1.16733",,
Battle of Albert (1916),1916-07-13,,"Battle of Albert (1916) Part of the Battle of the Somme (First World War) 300pxBritish, French and German positions during Battle of Albert Date 1–13 July 1916 Location Somme, Picardy, France Result German defensive victory in north and centre;limited Allied advance in south.",,,,,,,"49.993,2.712",,
Battle of Albert (1916),1916-07-13,,"Battle of Albert (1916) Part of the Battle of the Somme (First World War) 300pxBritish, French and German positions during Battle of Albert Date 1–13 July 1916 Location Somme, Picardy, France Result German defensive victory in north and centre;limited Allied advance in south.",,,,,,,"49.993,2.712",,
Battle of Gumbinnen,1914-08-20,,"The Battle of Gumbinnen, initiated by forces of the German Empire on August 20, 1914, was the first major German offensive on the Eastern Front during the First World War. Because of the hastiness of the German attack, however, the Russian army emerged victorious.",,,,,,,"54.6,22.2",,
First Battle of Garua,1914-08-31,,The First Battle of Garua took place from 29 to 31 August 1914 during the Kamerun Campaign of the First World War between German and invading British forces in northern Kamerun at Garua. It was the first significant action to take place in the campaign and resulted in the German repulsion of the British force.,,,,,,,"9.3,13.4",,
First Battle of Garua,1914-08-31,,The First Battle of Garua took place from 29 to 31 August 1914 during the Kamerun Campaign of the First World War between German and invading British forces in northern Kamerun at Garua. It was the first significant action to take place in the campaign and resulted in the German repulsion of the British force.,,,,,,,"9.3,13.4",,
Battle of Gurin,1915-04-29,,"The Battle of Gurin took place on 29 April 1915 during the Kamerun Campaign of World War I in Gurin, British Nigeria near the border with German Kamerun. The battle was one of the largest of the German forays into the British colony. It ended in a successful British repulsion of the German force.",,,,,,,"9.11489,12.8773",,
Battle of Messines (1917),1917-06-14,,"The Battle of Messines (7–14 June 1917) was an offensive conducted by the British Second Army, under the command of General Herbert Plumer, on the Western Front near the village of Messines in Belgian West Flanders during the First World War. The Nivelle offensive in April and May had failed to achieve its more ambitious aims and this had resulted in the demoralisation of French troops and the dislocation of the Anglo-French strategy for 1917.",,,,,,,"50.7644,2.8981",,
Battle of Ngaundere,1915-06-29,,The Battle of Ngaundere or Battle of Ngaoundéré was a small engagement fought between German and British forces on 29 July 1915 during the Kamerun campaign of World War I. It resulted in a German defeat and British occupation of the town.,,,,,,,"7.32167,13.585",,
Battle of Banjo,1915-11-06,,"During the Battle of Banjo or Battle of Banyo, British forces besieged German forces entrenched on the Banjo mountain from 4 to 6 November 1915 during the Kamerun campaign of the First World War. By 6 November much of the German force had deserted, while the rest surrendered. The battle resulted in victory for the Allies and breakdown of German resistance in northern Kamerun.",,,,,,,"6.775,11.8183",,
Battle of Nsanakong,1914-09-06,,"The Battle of Nsanakong or Battle of Nsanakang took place between defending British and attacking German forces during the Kamerun Campaign of the First World War. The town of Nsanakong had been occupied by the British on 30 August 1914. On 6 September, German forces attacked, driving the British force over the border back into Nigeria.",,,,,,,"5.87617,8.97467",,
Second Battle of Edea,1915-01-05,,"The Second Battle of Edea was the German counter-attack against French forces stationed in the village of Edea during the Kamerun Campaign of the First World War. Allied forces from Duala occupied the town following the First Battle of Edea in October 1914. The Germans, eager to retake the position attacked on 5 January 1915 but were repulsed by the French force.",,,,,,,"3.8,10.1333",,
Second Battle of Garua,1915-06-10,,"The Second Battle of Garua took place from 31 May to 10 June 1915 during the Kamerun campaign of the First World War in Garua, German Kamerun. The battle was between a combined French and British force and defending German garrison and resulted in an Allied victory.",,,,,,,"9.3,13.4",,
Battle of Jabassi,1914-10-07,,The Battle of Jabassi or Battle of Yabassi was a pair of assaults on German positions at Jabassi on the Wuri river during the Kamerun Campaign of World War I between German and British forces on 7 and 14 October 1914. The action resulted in British victory and their occupation of the station.,,,,,,,"4.45,9.96667",,
Battle of Tulkarm,1918-09-19,,"The Battle of Tulkarm took place on 19 September 1918, beginning of the Battle of Sharon, which along with the Battle of Nablus formed the set piece Battle of Megiddo fought between 19 and 25 September in the last months of the Sinai and Palestine Campaign of the First World War.",,,,,,,"32.3115,35.027",,
Second Battle of Jaunde,1915-10-09,,"The Second Battle of Jaunde involved the successful British and French assault on the German capital of Jaunde during the Kamerun Campaign of the First World War. After the failure of the First Battle of Jaunde during the summer of 1915, the bulk of Allied forces had retreated to the Kele river. Following the Second Duala Conference where Allied commanders discussed the situation, it was decided that another assault should be attempted.",,,,,,,"3.86667,11.5167",,
Siege of Mora,1914-08-26,,The Siege of Mora or Siege of Moraberg between Allied and besieged German troops from August 1914 to February 1916 on and around the Mora mountain in northern Kamerun during the Kamerun Campaign of the First World War. After more than a year of siege German forces on the mountain surrendered following the escape of many German troops to the neutral Spanish colony of Rio Muni.,,,,,,,"11.05,14.15",,
Battle of Tepe,1914-08-25,,"The Battle of Tepe (or Tebe) on 25 August 1914 was the first skirmish between German and British forces during the Kamerun Campaign in of the First World War. The conflict took place on the border between British Nigeria and German Kamerun, ending in British victory and German withdrawal from the station.",,,,,,,"9.34117,12.8732",,
